{
  "manifest":{"product":"Cost IQ","schemaVersion":"1.1","masterVersion":"5.1.0","releaseId":"COSTIQ-2026.09.001","releaseStatus":"draft","lastUpdated":"2026-09-14","author":"LTM Cost IQ Methodology"},
  "dimensions":[{"id":"COST-01","name":"Spend Transparency","type":"cost","weight":1},{"id":"COST-03","name":"Cloud Economics","type":"cost","weight":1},{"id":"VALUE-03","name":"Benefits Realization","type":"value","weight":1}],
  "questions":[
    {"id":"CORE-12","section":"Spend & Financial Visibility","prompt":"Which statement best describes your ability to explain where total technology spend goes?","intent":"Assess whether the CIO has an enterprise-wide cost baseline rather than fragmented views.","interaction":"single-select","answerDesign":"Choose the statement that best reflects the normal enterprise reality.","required":true,"options":[{"id":"A","label":"We have an enterprise-wide view with major technology categories reconciled and ownership clear."},{"id":"B","label":"We have a strong IT view, but some business-led or indirect technology spend sits outside it."},{"id":"C","label":"We know the major categories, but allocation and ownership are inconsistent."},{"id":"D","label":"We mainly see vendor or departmental spend and cannot reliably build an enterprise picture."},{"id":"E","label":"We do not have a reliable enterprise technology spend baseline."}],"scoring":{"dimensionIds":["COST-01"],"defaultMap":{"A":100,"B":80,"C":55,"D":30,"E":10}},"findingIds":["F-001"],"recommendationIds":["R-001"],"active":true,"version":1},
    {"id":"CORE-24","section":"Cloud Economics","prompt":"How effectively does your organization optimize cloud consumption against actual business demand?","intent":"Determine whether cloud consumption is actively managed for waste, sizing and demand alignment.","interaction":"slider","answerDesign":"Use the position that best represents current practice, not future ambition.","required":true,"control":{"min":0,"max":100,"step":5,"leftLabel":"Largely unmanaged","rightLabel":"Continuously optimized"},"options":[],"scoring":{"dimensionIds":["COST-03"],"normalize":"direct-0-100"},"findingIds":["F-005"],"recommendationIds":["R-003"],"active":true,"version":1},
    {"id":"CORE-44","section":"Technology Value","prompt":"For major technology investments, how consistently do you measure the business outcome you expected to achieve?","intent":"Assess whether major technology investments are linked to measurable business outcomes.","interaction":"single-select","answerDesign":"Choose the statement that best describes the normal practice, not an exceptional program.","required":true,"options":[{"id":"A","label":"We define a quantified baseline and target before approval, then track the outcome after delivery."},{"id":"B","label":"We define business KPIs and review them after delivery for major investments."},{"id":"C","label":"We track delivery, usage, or adoption metrics, but not consistently the business outcome."},{"id":"D","label":"Measurement varies by investment and is not applied consistently."},{"id":"E","label":"We do not consistently measure whether expected business benefits were achieved."}],"scoring":{"dimensionIds":["VALUE-03"],"defaultMap":{"A":100,"B":80,"C":55,"D":30,"E":10}},"findingIds":["F-004"],"recommendationIds":["R-009"],"active":true,"version":1}
  ],
  "rules":[{"id":"RULE-CLOUD-LEAK","area":"Cloud","condition":"CORE-24 below 50","action":"Trigger cloud consumption finding","triggerKey":"Cloud","questionRefs":["CORE-24"]},{"id":"RULE-BENEFITS-LEAK","area":"Value","condition":"CORE-44 A-E with outcome strength threshold","action":"Trigger benefits realization finding","triggerKey":"Benefits","questionRefs":["CORE-44"]}],
  "findings":[{"id":"F-001","title":"Technology spend baseline is not sufficiently transparent","description":"The current cost view may not provide a reliable enterprise picture for challenge, allocation or investment decisions.","severity":"high","dimensionId":"COST-01","recommendationIds":["R-001"]},{"id":"F-004","title":"Technology investment benefits are not consistently measured","description":"Benefits may be tracked unevenly, reducing the CIO's ability to distinguish investment that creates value from investment that simply consumes budget.","severity":"high","dimensionId":"VALUE-03","recommendationIds":["R-009"]},{"id":"F-005","title":"Cloud consumption may contain avoidable leakage","description":"Cloud consumption appears insufficiently aligned to actual demand, creating potential optimization and cost-avoidance opportunity subject to evidence validation.","severity":"high","dimensionId":"COST-03","recommendationIds":["R-003"]}],
  "recommendations":[{"id":"R-001","title":"Establish an Enterprise Technology Spend Baseline","description":"Create a reconciled view of technology spend across major categories, ownership and material business-led spend.","ltmService":"Technology Spend & Cost Baseline","findingIds":["F-001"]},{"id":"R-003","title":"Run a Cloud Economics Diagnostic","description":"Validate demand alignment, rightsizing, commitment strategy, tagging and consumption governance before sizing any savings opportunity.","ltmService":"FinOps & Cloud Cost Optimization","findingIds":["F-005"]},{"id":"R-009","title":"Institutionalize Benefits Realization","description":"Set measurable benefit baselines, targets and post-implementation reviews for major technology investments.","ltmService":"Evidence-Led Cost & Value Assessment","findingIds":["F-004"]}],
  "settings":{"opportunityLabel":"Illustrative opportunity range — requires evidence validation","confidenceModifiers":{"high":1,"medium":0.8,"low":0.6}}
}